{
  "agent": {
    "type": "claude-code",
    "version": "2.1.177"
  },
  "captureTier": "redacted",
  "endedAt": "2026-07-01T14:12:30.000Z",
  "env": {
    "cwd": "/home/dev/acme-api",
    "gitBranch": "fix/rate-limit-window"
  },
  "events": [],
  "id": "77777777-7777-4777-8777-777777777777",
  "models": [
    "claude-haiku-4-5-20251001"
  ],
  "schemaVersion": 1,
  "startedAt": "2026-07-01T14:10:00.000Z",
  "subagent": {
    "agentId": "a1b2c3d4e5f60718",
    "parentSessionId": "5c3a1b2d-4e6f-4708-9a1b-2c3d4e5f6a7b"
  },
  "totals": {
    "cacheCreationTokens": 0,
    "cacheReadTokens": 950,
    "costUsd": 0.0007,
    "inputTokens": 3,
    "outputTokens": 120
  },
  "turns": [
    {
      "costUsd": 0.0007,
      "index": 0,
      "model": "claude-haiku-4-5-20251001",
      "role": "assistant",
      "text": null,
      "toolCalls": [
        {
          "isEdit": false,
          "name": "Grep",
          "status": "ok"
        },
        {
          "file": "src/window.ts",
          "isEdit": false,
          "name": "Read",
          "status": "ok"
        }
      ],
      "ts": "2026-07-01T14:10:05.000Z",
      "usage": {
        "cacheCreate": 0,
        "cacheRead": 950,
        "in": 3,
        "out": 120
      }
    }
  ],
  "warnings": []
}
