{
  "agent": {
    "type": "claude-code"
  },
  "captureTier": "metrics",
  "env": {},
  "events": [],
  "id": "0f0e0d0c-0b0a-4908-8706-050403020100",
  "models": [],
  "schemaVersion": 1,
  "startedAt": "2026-07-01T10:00:00.000Z",
  "totals": {
    "cacheCreationTokens": 0,
    "cacheReadTokens": 0,
    "inputTokens": 0,
    "outputTokens": 0
  },
  "turns": [],
  "warnings": []
}
